Windows PowerShell
Copyright (C) Microsoft Corporation. All rights reserved.

PS C:\Academics\Codes\Kathford> sqlplus

SQL*Plus: Release 10.2.0.1.0 - Production on Sun Mar 17 09:54:02 2019

Copyright (c) 1982, 2005, Oracle.  All rights reserved.

Enter user-name: manager
Enter password:
ERROR:
ORA-01017: invalid username/password; logon denied


Enter user-name:
ERROR:
ORA-01017: invalid username/password; logon denied


Enter user-name: system
Enter password:

Connected to:
Oracle Database 10g Express Edition Release 10.2.0.1.0 - Production

SQL> create user nam identified by nam;

User created.

SQL> connect nam;
Enter password:
ERROR:
ORA-01045: user NAM lacks CREATE SESSION privilege; logon denied


Warning: You are no longer connected to ORACLE.
SQL> grant dba to nam;
SP2-0640: Not connected
SQL> exit
PS C:\Academics\Codes\Kathford> sqlplus

SQL*Plus: Release 10.2.0.1.0 - Production on Sun Mar 17 11:48:58 2019

Copyright (c) 1982, 2005, Oracle.  All rights reserved.

Enter user-name: system
Enter password:

Connected to:
Oracle Database 10g Express Edition Release 10.2.0.1.0 - Production

SQL> grant dba to nam;

Grant succeeded.


SQL> select * from customer
  2  ;

       CID CNAME
---------- --------------------
         1 Ram
         2 Shyam
         3 Hari

SQL> create view salesrecord as select s.salesperson, c.cname from sales s inner join customer c on s.c_id=c.cid;

View created.


SQL> select * from salesrecord;

SALESPERSON               CNAME
------------------------- --------------------
                          Ram
                          Shyam
                          Hari

SQL> select * from sales;

       SID     CAT_ID       C_ID       P_ID SALESPERSON
---------- ---------- ---------- ---------- -------------------------
         1          1          1          1
         2          2          2          3
         3          1          3          2

SQL> update sales set salesperson='Aurora' where sid=1;

1 row updated.

SQL> update sales set salesperson='Eudora' where sid=2;

1 row updated.

SQL> update sales set salesperson='Kimmy' where sid=3;

1 row updated.

SQL> commit;

Commit complete.

SQL> select * from salesrecord;

SALESPERSON               CNAME
------------------------- --------------------
Aurora                    Ram
Eudora                    Shyam
Kimmy                     Hari

SQL> tasc sales;
SP2-0042: unknown command "tasc sales" - rest of line ignored.
SQL> desc sales;
 Name                                      Null?    Type
 ----------------------------------------- -------- ----------------------------
 SID                                       NOT NULL NUMBER(2)
 CAT_ID                                             NUMBER(2)
 C_ID                                               NUMBER(2)
 P_ID                                               NUMBER(2)
 SALESPERSON                                        VARCHAR2(25)





SQL> select * from salesrecord;

no rows selected

SQL> create or replace view salesrecord as select s.salesperson as seller, c.cname as customer, p.pname as product, p.price*q.qty as paid from sales s inner join customer c on s.c_id=c.cid left join purchase q on c.cid=q.c_id left join product p on p.pid=q.p_id;

View created.

SQL> select * from salesrecord;
SELLER                    CUSTOMER             PRODUCT                    PAID
------------------------- -------------------- -------------------- ----------
Kimmy                     Hari
Aurora                    Ram
Eudora                    Shyam

SQL> create or replace view salesrecord as select s.salesperson as seller, c.cname as customer, p.pname as product, p.price*q.qty as paid from sales s inner join customer c on s.c_id=c.cid inner join purchase q on c.cid=q.c_id left join product p on p.pid=q.p_id;

View created.

SQL> select * from salesrecord;
no rows selected

SQL> create or replace view salesrecord as select s.salesperson as seller, c.cname as customer, p.pname as product, p.price*q.qty as paid from sales s inner join customer c on s.c_id=c.cid inner join purchase q on c.cid=q.c_id inner join product p on p.pid=q.p_id;

View created.

SQL> select * from salesrecord;
no rows selected

SQL> create or replace view salesrecord as select s.salesperson as seller, c.cname as customer, p.pname as product, p.price*q.qty as paid from sales s inner join customer c on s.c_id=c.cid inner join purchase q on c.cid=q.c_id inner join product p on p.pid=q.p_id;

View created.

SQL> select * from salesrecord;
no rows selected

SQL> create or replace view salesrecord as select s.salesperson as seller, c.cname as customer, p.pname as product, p.price*q.qty as paid from sales s inner join customer c on s.c_id=c.cid inner join purchase q on c.cid=q.c_id left join product p on p.pid=q.p_id;

View created.

SQL> select * from salesrecord;
no rows selected

SQL> create or replace view salesrecord as select s.salesperson as seller, c.cname as customer, p.pname as product, p.price*q.qty as paid from sales s inner join customer c on s.c_id=c.cid left join purchase q on c.cid=q.c_id left join product p on p.pid=q.p_id;

View created.

SQL> select * from salesrecord;
SELLER                    CUSTOMER             PRODUCT                    PAID
------------------------- -------------------- -------------------- ----------
Kimmy                     Hari
Aurora                    Ram
Eudora                    Shyam

SQL> desc product Name                                      Null?    Type
 ----------------------------------------- -------- ----------------------------
 PID                                       NOT NULL NUMBER(2)
 PNAME                                              VARCHAR2(20)
 PRICE                                              NUMBER(10)
 CAT_ID                                             NUMBER(2)

SQL> desc purchase;
 Name                                      Null?    Type
 ----------------------------------------- -------- ----------------------------
 C_ID                                               NUMBER(2)
 P_ID                                               NUMBER(2)
 QTY                                                NUMBER(4)

SQL> desc sales;
 Name                                      Null?    Type
 ----------------------------------------- -------- ----------------------------
 SID                                       NOT NULL NUMBER(2)
 CAT_ID                                             NUMBER(2)
 C_ID                                               NUMBER(2)
 P_ID                                               NUMBER(2)
 SALESPERSON                                        VARCHAR2(25)

SQL> desc customer;
 Name                                      Null?    Type
 ----------------------------------------- -------- ----------------------------
 CID                                       NOT NULL NUMBER(2)
 CNAME                                              VARCHAR2(20)

SQL> create or replace view salesrecord as select s.salesperson as seller, c.cname as customer, p.pname as product, p.price*q.qty as paid from sales s inner join customer c on s.c_id=c.cid left join purchase q on c.cid=q.c_id left join product p on s.cat_id=p.cat_id;

View created.

SQL> select * from salesrecord;
SELLER                    CUSTOMER             PRODUCT                    PAID
------------------------- -------------------- -------------------- ----------
Aurora                    Ram                  Mobile
Kimmy                     Hari                 Mobile
Aurora                    Ram                  TV
Kimmy                     Hari                 TV
Eudora                    Shyam                Wai Wai

SQL> commit;

Commit complete.

SQL> create or replace view salesrecord as select s.salesperson as seller, c.cname as customer, p.pname as product, p.price*q.qty as paid from sales s inner join customer c on s.c_id=c.cid left join product p on s.cat_id=p.cat_id left join purchase q on p.pid=q.p_id;

View created.

SQL> select * from salesrecord;
SELLER                    CUSTOMER             PRODUCT                    PAID
------------------------- -------------------- -------------------- ----------
Eudora                    Shyam                Wai Wai
Aurora                    Ram                  Mobile
Kimmy                     Hari                 Mobile
Aurora                    Ram                  TV
Kimmy                     Hari                 TV

SQL> create or replace view salesrecord as select s.salesperson as seller, c.cname as customer, p.pname as product, p.price*q.qty as paid from sales s inner join customer c on s.c_id=c.cid left join product p on s.cat_id=p.cat_id left join purchase q on s.p_id=q.p_id;

View created.

SQL> select * from salesrecord;
SELLER                    CUSTOMER             PRODUCT                    PAID
------------------------- -------------------- -------------------- ----------
Kimmy                     Hari                 Mobile
Aurora                    Ram                  Mobile
Kimmy                     Hari                 TV
Aurora                    Ram                  TV
Eudora                    Shyam                Wai Wai

SQL>